{"cuda_home":"/opt/cuda-13.1","devices":[{"major":195,"minor":0,"path":"/dev/nvidia0"},{"major":195,"minor":1,"path":"/dev/nvidia1"},{"major":195,"minor":255,"path":"/dev/nvidiactl"},{"major":511,"minor":0,"path":"/dev/nvidia-uvm"}],"driver_version":"595.84","files":[{"path":"/usr/lib/x86_64-linux-gnu/libcuda.so.595.84","sha256":"sha256:0000000000000000000000000000000000000000000000000000000000000000"},{"path":"/opt/sglang015/lib/python3.12/site-packages/nvidia/cu13/lib/libnvvm.so.4","sha256":"sha256:0000000000000000000000000000000000000000000000000000000000000000"},{"path":"/opt/sglang015/lib/python3.12/site-packages/nvidia/cu13/bin/ptxas","sha256":"sha256:0000000000000000000000000000000000000000000000000000000000000000"},{"path":"/opt/sglang015/lib/python3.12/site-packages/nvidia/cu13/bin/tileiras","sha256":"sha256:0000000000000000000000000000000000000000000000000000000000000000"},{"path":"/opt/sglang015/lib/python3.12/site-packages/cutlass/compiler.so","sha256":"sha256:73b760621e35910305e7bdf8f4c2c0d928c10527a243f8f11a76046edba4f6d8"},{"path":"/usr/bin/g++-13","sha256":"sha256:0000000000000000000000000000000000000000000000000000000000000000"},{"path":"/opt/cuda-13.1/targets/x86_64-linux/lib/libcudart.so.13.1.80","sha256":"sha256:0000000000000000000000000000000000000000000000000000000000000000"},{"path":"/opt/cuda-13.1/bin/nvcc","sha256":"sha256:0000000000000000000000000000000000000000000000000000000000000000"},{"path":"/opt/cuda-13.1/nvvm/lib64/libnvvm.so.4","sha256":"sha256:0000000000000000000000000000000000000000000000000000000000000000"},{"path":"/opt/cuda-13.1/bin/ptxas","sha256":"sha256:0000000000000000000000000000000000000000000000000000000000000000"},{"path":"/opt/sglang015/lib/python3.12/site-packages/nvidia/cu13/lib/libnvJitLink.so.13","sha256":"sha256:0000000000000000000000000000000000000000000000000000000000000000"},{"path":"/opt/sglang015/bin/python3.12","sha256":"sha256:0000000000000000000000000000000000000000000000000000000000000000"},{"path":"/opt/sglang015/lib/python3.12/site-packages/sgl_kernel/common_ops.abi3.so","sha256":"sha256:0000000000000000000000000000000000000000000000000000000000000000"},{"path":"/opt/sglang015/lib/python3.12/site-packages/torch/lib/libtorch_cuda.so","sha256":"sha256:0000000000000000000000000000000000000000000000000000000000000000"},{"path":"/opt/sglang015/lib/python3.12/site-packages/nvidia/cu13/lib/libcudart.so.13.0.96","sha256":"sha256:0000000000000000000000000000000000000000000000000000000000000000"},{"path":"/opt/sglang015/lib/python3.12/site-packages/triton/backends/nvidia/bin/ptxas","sha256":"sha256:0000000000000000000000000000000000000000000000000000000000000000"}],"gpu_model":"NVIDIA A100-SXM4-40GB","gpu_uuids":["GPU-00000000-0000-0000-0000-000000000001","GPU-00000000-0000-0000-0000-000000000002"],"host_toolkit":"CUDA_13_1_UPDATE_1","packages":{"cuda-tile":"1.3.0","flashinfer-cubin":"0.6.12","flashinfer-python":"0.6.12","nvidia-cuda-nvcc":"13.2.86","nvidia-cuda-tileiras":"13.2.86","nvidia-cutlass-dsl":"4.5.2","nvidia-cutlass-dsl-libs-base":"4.5.2","nvidia-cutlass-dsl-libs-cu13":"4.5.2","nvidia-nvjitlink":"13.0.88","nvidia-nvvm":"13.2.86","setuptools":"81.0.0","sglang":"0.5.15","sglang-kernel":"0.4.4+cu130","torch":"2.11.0+cu130","triton":"3.6.0"},"platform":"linux/x86_64","producer_version":"0.5.15","python_version":"3.12.13","roles":{"cuda_driver":"/usr/lib/x86_64-linux-gnu/libcuda.so.595.84","cutile_nvvm":"/opt/sglang015/lib/python3.12/site-packages/nvidia/cu13/lib/libnvvm.so.4","cutile_ptxas":"/opt/sglang015/lib/python3.12/site-packages/nvidia/cu13/bin/ptxas","cutile_tileiras":"/opt/sglang015/lib/python3.12/site-packages/nvidia/cu13/bin/tileiras","cutlass_compiler":"/opt/sglang015/lib/python3.12/site-packages/cutlass/compiler.so","cxx":"/usr/bin/g++-13","host_cudart":"/opt/cuda-13.1/targets/x86_64-linux/lib/libcudart.so.13.1.80","host_nvcc":"/opt/cuda-13.1/bin/nvcc","host_nvvm":"/opt/cuda-13.1/nvvm/lib64/libnvvm.so.4","host_ptxas":"/opt/cuda-13.1/bin/ptxas","nvjitlink":"/opt/sglang015/lib/python3.12/site-packages/nvidia/cu13/lib/libnvJitLink.so.13","python":"/opt/sglang015/bin/python3.12","sglang_kernel":"/opt/sglang015/lib/python3.12/site-packages/sgl_kernel/common_ops.abi3.so","torch_cuda":"/opt/sglang015/lib/python3.12/site-packages/torch/lib/libtorch_cuda.so","torch_cudart":"/opt/sglang015/lib/python3.12/site-packages/nvidia/cu13/lib/libcudart.so.13.0.96","triton_ptxas":"/opt/sglang015/lib/python3.12/site-packages/triton/backends/nvidia/bin/ptxas"},"schema_version":"inferdrome.sglang-direct-runtime.v1","site_packages":"/opt/sglang015/lib/python3.12/site-packages","source_commit":"f63458b5beaceabbd9d749b9fc956370e1b649e6","wheels":[{"name":"cuda-tile","path":"/opt/wheels/cuda-tile.whl","sha256":"sha256:e4865acbff1172aaee304bf9c550586088d8b4545a384423597a590899386709","version":"1.3.0"},{"name":"flashinfer-cubin","path":"/opt/wheels/flashinfer-cubin.whl","sha256":"sha256:01de132c493bb21d5df42ebe6890966cf83b40aa970dae06b2a3c0bed85f13ec","version":"0.6.12"},{"name":"flashinfer-python","path":"/opt/wheels/flashinfer-python.whl","sha256":"sha256:0c7a01e586b4796810d974cbf13a9c0eb2ade6a94d12e3220cf7782a1c09b8d3","version":"0.6.12"},{"name":"nvidia-cuda-nvcc","path":"/opt/wheels/nvidia-cuda-nvcc.whl","sha256":"sha256:7d3f56c8d705bad35bbba69eb0470d90856fd5d4dc48c6a6173aaf1e9f887cf5","version":"13.2.86"},{"name":"nvidia-cuda-tileiras","path":"/opt/wheels/nvidia-cuda-tileiras.whl","sha256":"sha256:832f360aa8ce478ff878c4e6630cd767349a597ea54382e7c07a835b0daead96","version":"13.2.86"},{"name":"nvidia-cutlass-dsl","path":"/opt/wheels/nvidia-cutlass-dsl.whl","sha256":"sha256:68ed1b63ca74aae87955012da9dfd7fdaae471329d0028b229b841c7192ccf52","version":"4.5.2"},{"name":"nvidia-cutlass-dsl-libs-base","path":"/opt/wheels/nvidia-cutlass-dsl-libs-base.whl","sha256":"sha256:15ef6a59193667e663934ef4873f8ccad37455e9b7c3c419c3072113b8aedf61","version":"4.5.2"},{"name":"nvidia-cutlass-dsl-libs-cu13","path":"/opt/wheels/nvidia-cutlass-dsl-libs-cu13.whl","sha256":"sha256:80f0cd402e0f1d1571e5aed33bfa17dbc9cb90cc5b1352f0f806b4788558e80e","version":"4.5.2"},{"name":"nvidia-nvjitlink","path":"/opt/wheels/nvidia-nvjitlink.whl","sha256":"sha256:13a74f429e23b921c1109976abefacc69835f2f433ebd323d3946e11d804e47b","version":"13.0.88"},{"name":"nvidia-nvvm","path":"/opt/wheels/nvidia-nvvm.whl","sha256":"sha256:a9244f3209922d655612c11ebb4117ea1f80983cb2b215c9cccded127282cebc","version":"13.2.86"},{"name":"setuptools","path":"/opt/wheels/setuptools.whl","sha256":"sha256:fdd925d5c5d9f62e4b74b30d6dd7828ce236fd6ed998a08d81de62ce5a6310d6","version":"81.0.0"},{"name":"sglang","path":"/opt/wheels/sglang.whl","sha256":"sha256:b737df527bbba96fe098a02d182e98f72a1b3564d7fc754629041129a5d8edc1","version":"0.5.15"},{"name":"sglang-kernel","path":"/opt/wheels/sglang-kernel.whl","sha256":"sha256:eb19842cd9809cce7e71d291aa1808f3a7e8c7ad46070a505d970e1ca8105240","version":"0.4.4+cu130"},{"name":"torch","path":"/opt/wheels/torch.whl","sha256":"sha256:96911323dcfcd42028c7e8edde7bdf25bb187753234e8775f0f3f112e86a22db","version":"2.11.0+cu130"},{"name":"triton","path":"/opt/wheels/triton.whl","sha256":"sha256:74caf5e34b66d9f3a429af689c1c7128daba1d8208df60e81106b115c00d6fca","version":"3.6.0"}]}
